<?xml version="1.0" encoding="UTF-8"?>
<ob:Obavestenje xmlns:vc="http://www.w3.org/2007/XMLSchema-versioning"
 xmlns:ob="obavestenje"
 xmlns:xsi="http://www.w3.org/2001/XMLSchema-instance"
 xsi:schemaLocation="obavestenje file:/C:/Users/matth/Documents/OxygenXMLEditor/projects/obavestenjecir.xsd">
    <ob:BrojPredmeta>BrojPredmeta0</ob:BrojPredmeta>
    <ob:Datum>2006-05-04</ob:Datum>
    <ob:Organ>
        <ob:Naziv>Naziv0</ob:Naziv>
        <ob:Sediste>Sediste0</ob:Sediste>
    </ob:Organ>
    <ob:PodnosiocZahteva>
        <ob:Ime>Ime0</ob:Ime>
        <ob:Prezime>Prezime0</ob:Prezime>
        <ob:Naziv>Naziv1</ob:Naziv>
        <ob:Adresa>
            <ob:Mesto>Mesto0</ob:Mesto>
            <ob:Ulica>Ulica0</ob:Ulica>
            <ob:Broj>50</ob:Broj>
        </ob:Adresa>
    </ob:PodnosiocZahteva>
    <ob:TrazenaInformacija>
        <ob:DatumZahteva>2006-05-04</ob:DatumZahteva>
        <ob:OpisInformacije>OpisInformacije0</ob:OpisInformacije>
    </ob:TrazenaInformacija>
    <ob:InformacijeOUvidu>
        <ob:Datum>2006-05-04</ob:Datum>
        <ob:Satnica>01:01:01.001</ob:Satnica>
        <ob:SatnicaOd>01:01:01.001</ob:SatnicaOd>
        <ob:SatnicaDo>01:01:01.001</ob:SatnicaDo>
        <ob:Adresa>
            <ob:Mesto>Mesto1</ob:Mesto>
            <ob:Ulica>Ulica1</ob:Ulica>
            <ob:Broj>50</ob:Broj>
        </ob:Adresa>
        <ob:BrojKancelarije>50</ob:BrojKancelarije>
    </ob:InformacijeOUvidu>
    <ob:Troskovi>
        <ob:CenaA4>3.0</ob:CenaA4>
        <ob:CenaA3>6.0</ob:CenaA3>
        <ob:CenaCD>35.0</ob:CenaCD>
        <ob:CenaDisketa>20.0</ob:CenaDisketa>
        <ob:CenaDVD>40.0</ob:CenaDVD>
        <ob:CenaAudioKaseta>150.0</ob:CenaAudioKaseta>
        <ob:CenaVideoKaseta>300.0</ob:CenaVideoKaseta>
        <ob:CenaEDokument>30.0</ob:CenaEDokument>
    </ob:Troskovi>
    <ob:InformacijeOUplati>
        <ob:UkupniTroskovi>0</ob:UkupniTroskovi>
        <ob:ZiroRacun>840-0000742328843-30</ob:ZiroRacun>
        <ob:BrojModela>97</ob:BrojModela>
    </ob:InformacijeOUplati>
    <ob:Dostavljeno>Imenovanom</ob:Dostavljeno>
</ob:Obavestenje>
